<?xml version="1.0"?>
<!-- edited with XML Spy v4.0 U (http://www.xmlspy.com) by Robert K. Peet (private) -->
<!DOCTYPE dataModel SYSTEM "tableStructure.dtd">
<dataModel>
	<title>Vegetation Plots Database Component Description: commUsage</title>
	<author>J. Harris </author>
	<institution>NCEAS </institution>
	<contributor>R.K. Peet</contributor>
	<description/>
	<date>7 February 2002</date>
	<entity>
		<entityName>commTaxa.commUsage</entityName>
		<entitySummary>This table links a community name with a concept.</entitySummary>
		<entityDescription/>
		<attribute>
			<attName>COMMUSAGE_ID</attName>
			<attNulls>No</attNulls>
			<attType>INT</attType>
			<attKey>PK</attKey>
			<attReferences>n/a</attReferences>
			<attNotes>n/a</attNotes>
			<attDefinition>Database assigned value to each unique record in the communityUsage table.</attDefinition>
		</attribute>
		<attribute>
			<attName>COMMNAME_ID</attName>
			<attNulls>No</attNulls>
			<attType>INT</attType>
			<attKey>FK</attKey>
			<attReferences>commName.COMMNAME_ID</attReferences>
			<attNotes>n/a</attNotes>
			<attDefinition>This field is the foreign key into the commName table.</attDefinition>
		</attribute>
		<attribute>
			<attName>COMMCONCEPT_ID</attName>
			<attNulls>No</attNulls>
			<attType>INT</attType>
			<attKey>FK</attKey>
			<attReferences>commConcept.COMMCONCEPT_ID</attReferences>
			<attNotes>n/a</attNotes>
			<attDefinition>This field is the foreign key into the commConcept table.</attDefinition>
		</attribute>
		<attribute>
			<attName>usageStart</attName>
			<attNulls>No</attNulls>
			<attType>DATE</attType>
			<attKey>n/a</attKey>
			<attReferences>n/a</attReferences>
			<attNotes>n/a</attNotes>
			<attDefinition>This is the date on which the party applied the name to the concept.</attDefinition>
		</attribute>
		<attribute>
			<attName>usageStop</attName>
			<attNulls>Yes</attNulls>
			<attType>DATE</attType>
			<attKey>n/a</attKey>
			<attReferences>n/a</attReferences>
			<attNotes>n/a</attNotes>
			<attDefinition>This is the date on which the party ceased to apply the name to the concept.</attDefinition>
		</attribute>
		<attribute>
			<attName>commNameStatus</attName>
			<attNulls>No</attNulls>
			<attType>VARCHAR(20)</attType>
			<attKey>n/a</attKey>
			<attReferences>n/a</attReferences>
			<attNotes>closed list</attNotes>
			<attDefinition>This field shows the status of the application of the name to the concept by the party (standard, not standard, undetermined).</attDefinition>
		</attribute>
		<attribute>
			<attName>COMMPARTY_ID</attName>
			<attNulls>No</attNulls>
			<attType>INT</attType>
			<attKey>FK</attKey>
			<attReferences>commParty.COMMPARTY_ID</attReferences>
			<attNotes>n/a</attNotes>
			<attDefinition>Foreign key that identifies the party that used the class concept with the name.</attDefinition>
		</attribute>
		<attribute>
			<attName>classSystem</attName>
			<attNulls>Yes</attNulls>
			<attType>VARCHAR(20)</attType>
			<attKey>n/a</attKey>
			<attReferences>n/a</attReferences>
			<attNotes>Like FGDC of Forest Cover Class.</attNotes>
			<attDefinition>This is the name of the classification system wherein the name is applied (e.g., Scientific, Spanish common).</attDefinition>
		</attribute>
		<children/>
	</entity>
</dataModel>
