<?xml version="1.0"?>
<!-- edited with XML Spy v4.3 U (http://www.xmlspy.com) by Robert K. Peet (private) -->
<!DOCTYPE dataModel SYSTEM "tableStructure.dtd">
<dataModel>
	<title>Vegetation Plots Database Component Description: plantCorrelation</title>
	<author>J. Harris </author>
	<institution>NCEAS </institution>
	<contributor>R.K. Peet</contributor>
	<description/>
	<date/>
	<entity>
		<entityName>planttaxa.plantCorrelation</entityName>
		<entitySummary>This table correlates multiple plant concepts as they 
change through time.</entitySummary>
		<entityDescription/>
		<attribute>
			<attName>PLANTCORRELATION_ID</attName>
			<attNulls>No</attNulls>
			<attType>INT</attType>
			<attKey>PK</attKey>
			<attReferences>n/a</attReferences>
			<attNotes>n/a</attNotes>
			<attDefinition>Database assigned value to each unique record in the plantCorrelation table.</attDefinition>
		</attribute>
		<attribute>
			<attName>PLANTSTATUS_ID</attName>
			<attNulls>No</attNulls>
			<attType>INT</attType>
			<attKey>FK</attKey>
			<attReferences>plantStatus.PLANTSTATUS_ID</attReferences>
			<attNotes>n/a</attNotes>
			<attDefinition>This is the foreign key into the plantStatus table "pointing" to a concept no longer viewed as standard by the party.</attDefinition>
		</attribute>
		<attribute>
			<attName>PLANTCONCEPT_ID</attName>
			<attNulls>No</attNulls>
			<attType>INT</attType>
			<attKey>FK</attKey>
			<attReferences>plantConcept.PLANTCONCEPT_ID</attReferences>
			<attNotes>n/a</attNotes>
			<attDefinition>This is the foreign key into the plantConcept table "pointing" to a concept recognized by the party as a "standard" concept.</attDefinition>
		</attribute>
		<attribute>
			<attName>plantConvergence</attName>
			<attNulls>No</attNulls>
			<attType>VARCHAR(20)</attType>
			<attKey>n/a</attKey>
			<attReferences>n/a</attReferences>
			<attNotes>closed list</attNotes>
			<attDefinition>This is the descriptive attribute that is used to relate the congruence between two concepts.</attDefinition>
		</attribute>
		<attribute>
			<attName>correlationStart</attName>
			<attNulls>No</attNulls>
			<attType>DATE</attType>
			<attKey>n/a</attKey>
			<attReferences>n/a</attReferences>
			<attNotes>n/a</attNotes>
			<attDefinition>This is the start date for recognition by a party of a correlation between two concepts.</attDefinition>
		</attribute>
		<attribute>
			<attName>correlationStop</attName>
			<attNulls>Yes</attNulls>
			<attType>DATE</attType>
			<attKey>n/a</attKey>
			<attReferences>n/a</attReferences>
			<attNotes>n/a</attNotes>
			<attDefinition>This is the stop date for recognition by a party of a correlation between two concepts.</attDefinition>
		</attribute>
		<children/>
	</entity>
</dataModel>
