<?xml version="1.0"?>
<!DOCTYPE dataModel SYSTEM "tableStructure.dtd">

<dataModel>	
<title>Prototype Veg Plots Database Component Description: 
    plotContributor</title>
<author>John Harris </author>
<institution>NCEAS </institution>
<contributor> </contributor>
<description> </description>
<date></date>

<entity>
	<entityName>vegPlot.PLOTCONTRIBUTOR</entityName>
	<entitySummary>This table stores information about a party contributing to
 a vegetation plot.</entitySummary>
	<entityDescription>This table serves as an interesection entity used to 
'link' a party with a specific vegetation plot. </entityDescription>
	<attribute> 
		<attName>plotContributor_id </attName>
		<attNulls>No </attNulls>	
		<attType>NUMBER </attType>
		<attKey>P</attKey>
		<attNotes>n/a</attNotes>
		<attReferences>n/a</attReferences>
		<attDefinition>Database assigned value for a party contributing to a 
            vegetation plot. </attDefinition>
	</attribute>



	<attribute>
                <attName>plot_id </attName>
                <attNulls>No </attNulls>
                <attType>NUMBER </attType>
                <attKey>F</attKey>
                <attReferences>PLOT</attReferences>
                <attNotes>This is the foreign key into the plot table. </attNotes>
                <attDefinition>Database assigned value for a given plot 
this is a link to the project entity. </attDefinition>
        </attribute>

	<attribute>
                <attName>party_id</attName>
                <attNulls>No </attNulls>
                <attType>NUMBER </attType>
                <attKey>F </attKey>
                <attReferences>PARTY </attReferences>
                <attNotes>This is the foreign key into the PARTY table.</attNotes>
                <attDefinition>Database assigned value for a given party this is a link to 
            the party entity. </attDefinition>
        </attribute>

	<attribute>
                <attName>roleCode</attName>
                <attNulls>No </attNulls>
                <attType>VARCHAR2 </attType>
                <attKey>n/a</attKey>
                <attReferences>n/a</attReferences>
                <attNotes>n/a</attNotes>
                <attDefinition>The role that a specific party (party_id) had in the 
            plot collection - this can include such roles as 
            PI, contact, author, etc.  This will be linked to an 
            entity named: </attDefinition>
        </attribute>


	<children> PARTY </children>
</entity>
</dataModel>	
