<?xml version="1.0"?>
<!-- edited with XML Spy v4.0 U (http://www.xmlspy.com) by Robert K. Peet (private) -->
<!DOCTYPE dataModel SYSTEM "tableStructure.dtd">
<dataModel>
	<title>Vegetation Plots Database Component Description: note</title>
	<author>J. Harris </author>
	<institution>NCEAS </institution>
	<contributor>R.K. Peet</contributor>
	<description/>
	<date>31October 2001</date>
	<entity>
		<entityName>vegPlot.Note</entityName>
		<entitySummary>This table is where notations associated with table records are stored</entitySummary>
		<entityDescription>All notes associated with plots and plot observations are stored in this table.  These notes can be linked to any table, record and attribute via the noteLink table.</entityDescription>
		<attribute>
			<attName>NOTE_ID</attName>
			<attNulls>No</attNulls>
			<attType>INT</attType>
			<attKey>PK</attKey>
			<attReferences>n/a</attReferences>
			<attNotes>Primary key for the note table</attNotes>
			<attDefinition>Database generated identifier assigned to each unique note. </attDefinition>
		</attribute>
		<attribute>
			<attName>NOTELINK_ID</attName>
			<attNulls>No</attNulls>
			<attType>INT</attType>
			<attKey>FK</attKey>
			<attReferences>noteLink.NOTELINK_ID</attReferences>
			<attNotes>Foreign key into the notelink table</attNotes>
			<attDefinition>Link to the noteLink table via which a note is associated with a table, record and attribute.</attDefinition>
		</attribute>
		<attribute>
			<attName>PARTY_ID</attName>
			<attNulls>No</attNulls>
			<attType>INT</attType>
			<attKey>FK</attKey>
			<attReferences>party.PARTY_ID</attReferences>
			<attNotes>Foreign key into the party table</attNotes>
			<attDefinition>Link to the party table to identify the party that contributed the note.</attDefinition>
		</attribute>
		<attribute>
			<attName>ROLE_ID</attName>
			<attNulls>No</attNulls>
			<attType>INT</attType>
			<attKey>FK</attKey>
			<attReferences>aux_Role.ROLE_ID</attReferences>
			<attNotes>Foreign key into the aux_role table</attNotes>
			<attDefinition>What role was the party palying when the note was applied?</attDefinition>
		</attribute>
		<attribute>
			<attName>noteDate</attName>
			<attNulls>Yes</attNulls>
			<attType>DATE</attType>
			<attKey>n/a </attKey>
			<attReferences>n/a </attReferences>
			<attNotes>n/a </attNotes>
			<attDefinition>The date on which the note was stored in the database.</attDefinition>
		</attribute>
		<attribute>
			<attName>noteType</attName>
			<attNulls>No</attNulls>
			<attType>VARCHAR(20)</attType>
			<attKey>n/a </attKey>
			<attReferences>n/a </attReferences>
			<attNotes>closed list</attNotes>
			<attDefinition>The type of note:  Database Management, Observation Author, Database User and Internal.  "Database Managment" notes are those added by the management team and may be queried and viewed by the public. "Database Use" notes are those entered by the users of the database and are publicly viewable.  "Internal" notes are for management to use internally and will not be broadcast.
</attDefinition>
		</attribute>
		<attribute>
			<attName>noteText </attName>
			<attNulls>No</attNulls>
			<attType>TEXT</attType>
			<attKey>n/a</attKey>
			<attReferences>n/a</attReferences>
			<attNotes>actual note text</attNotes>
			<attDefinition>The text of the note.</attDefinition>
		</attribute>
		<children/>
	</entity>
</dataModel>
