<?xml version="1.0"?>
<!DOCTYPE dataModel SYSTEM "tableStructure.dtd">

<dataModel>	

<title> Prototype Veg Plots Database Component Description: globalInference</title>
<author>J. Harris </author>
<institution>NCEAS </institution>
<contributor> </contributor>
<description> </description>
<date></date>



<entity>
	<entityName>vegPlot.globalInference</entityName>
	<entitySummary>This table stores information about the area used to infer 
	characteristics of plants which are common in size.</entitySummary>
	<entityDescription> </entityDescription>
	<attribute> 
		<attName>GLOBALINFERENCE_ID</attName>
		<attNulls>No</attNulls>	
		<attType>NUMBER </attType>
		<attKey>PK</attKey>
		<attReferences>n/a </attReferences>
		<attNotes>Primary key for globalInference table. </attNotes>
		<attDefinition>Database assigned value to each unique record in 
		the globalInference table. </attDefinition>
	</attribute>



	<attribute>
                <attName>OBS_ID</attName>
                <attNulls>No</attNulls>
                <attType>NUMBER</attType>
                <attKey>FK</attKey>
                <attReferences>vegPlotParty </attReferences>
                <attNotes>Foreign key into the plotObservation table. </attNotes>
                <attDefinition>n/a</attDefinition>
        </attribute>


	<attribute>
                <attName>globalInferenceArea</attName>
                <attNulls>No</attNulls>
                <attType>NUMBER</attType>
                <attKey>n/a</attKey>
		<attReferences>n/a </attReferences>
                <attNotes>n/a</attNotes>
                <attDefinition>This is the inference area used to characterize 
		the plants of the same dimensions.  These dimensions are defined 
		in the inferenceClassIndex table and may be characterized be either 
		height or diameter.</attDefinition>
        </attribute>



	<children> </children>
</entity>
</dataModel>	
