<?xml version="1.0"?>
<!-- edited with XML Spy v4.0 U (http://www.xmlspy.com) by Robert K. Peet (private) -->
<!DOCTYPE dataModel SYSTEM "tableStructure.dtd">
<dataModel>
	<title>Vegetation Plots Database Component Description: treeStem</title>
	<author>J. Harris </author>
	<institution>NCEAS </institution>
	<contributor>R.K. Peet</contributor>
	<description/>
	<date>23 Sep 2001</date>
	<entity>
		<entityName>vegPlot.treeStem</entityName>
		<entitySummary>This table is intended to store information about indivdual tree stem data collected during a plot observation event.</entitySummary>
		<entityDescription/>
		<attribute>
			<attName>STEM_ID</attName>
			<attNulls>No </attNulls>
			<attType>INT</attType>
			<attKey>PK </attKey>
			<attReferences>n/a</attReferences>
			<attNotes>Primary Key for the stemData table.</attNotes>
			<attDefinition>Database generated identifier assigned to each unique stem observation. </attDefinition>
		</attribute>
		<attribute>
			<attName>TAXONOBSERVATION_ID</attName>
			<attNulls>No</attNulls>
			<attType>INT</attType>
			<attKey>FK</attKey>
			<attReferences>taxonObservation.TAXONOBSERVATION_ID</attReferences>
			<attNotes>Foreign key into the taxonObservation table</attNotes>
			<attDefinition>Foreign key into the taxonObservation table, thereby associating a taxon identification with the tree stem(s).</attDefinition>
		</attribute>
		<attribute>
			<attName>stemCode</attName>
			<attNulls>Yes</attNulls>
			<attType>VARCHAR(20)</attType>
			<attKey>n/a </attKey>
			<attReferences>n/a </attReferences>
			<attNotes>n/a</attNotes>
			<attDefinition>Name or code applied to a specific stem in the plot. This is generally a numeric label to associate a fielddata entry with a stem in the database.</attDefinition>
		</attribute>
		<attribute>
			<attName>stemDiameter</attName>
			<attNulls>Yes</attNulls>
			<attType>NUMERIC(5,1)</attType>
			<attKey>n/a </attKey>
			<attReferences>n/a </attReferences>
			<attNotes>n/a</attNotes>
			<attDefinition>The diameter of the stem in centimeters. When diameter classes are used the the stemDiameter is the midpoint between the low end and high end for the diameter class;  the offset between this and the endpoints is stored in the stemDiameterAccuracy attribute.</attDefinition>
		</attribute>
		<attribute>
			<attName>stemDiameterAccuracy</attName>
			<attNulls>Yes</attNulls>
			<attType>NUMBER(2,1)</attType>
			<attKey>n/a </attKey>
			<attReferences>n/a </attReferences>
			<attNotes>n/a</attNotes>
			<attDefinition>The accuracy of the stem diameter measurements in centimeters. This represents the distance between the diameter class midpoint and endpoint.</attDefinition>
		</attribute>
		<attribute>
			<attName>stemXPosition</attName>
			<attNulls>Yes</attNulls>
			<attType>NUMBER(3,2)</attType>
			<attKey>n/a</attKey>
			<attReferences>n/a </attReferences>
			<attNotes/>
			<attDefinition>The X-coordinate of the stem position. The user will enter the relative position of stems with respect to the plot origin (in meters) with the x-axis defined by the plot azimuth.</attDefinition>
		</attribute>
		<attribute>
			<attName>stemYPosition</attName>
			<attNulls>Yes</attNulls>
			<attType>NUMBER(3,2)</attType>
			<attKey>n/a</attKey>
			<attReferences>n/a</attReferences>
			<attNotes>n/a</attNotes>
			<attDefinition>The Y-coordinate of the stem position, as above.</attDefinition>
		</attribute>
		<attribute>
			<attName>stemHeight</attName>
			<attNulls>Yes</attNulls>
			<attType>NUMBER(3,2)</attType>
			<attKey>n/a </attKey>
			<attReferences>n/a </attReferences>
			<attNotes>n/a</attNotes>
			<attDefinition>The measured height of the stem in meters. When height classes were used the stemHeight is the midpoint between the low end and high end for the height class; the offset between this and the endpointsis stored in the stemHeightAccuracy field.</attDefinition>
		</attribute>
		<attribute>
			<attName>stemHeightAccuracy</attName>
			<attNulls>Yes</attNulls>
			<attType>NUMBER(2,2)</attType>
			<attKey>n/a </attKey>
			<attReferences>n/a </attReferences>
			<attNotes>n/a</attNotes>
			<attDefinition>The accuracy of the measured height of a stem, being the offset between the midpoint of the class and the endpoint, in meters.</attDefinition>
		</attribute>
		<attribute>
			<attName>stemCount</attName>
			<attNulls>No</attNulls>
			<attType>INT</attType>
			<attKey>n/a </attKey>
			<attReferences>n/a </attReferences>
			<attNotes>The default value is 1.  This field is not logically necessary, but allows for more compact entry and storage of tree stem tally data.</attNotes>
			<attDefinition>The number of stems of a single species that have a common stem diameter and lack height and location data.</attDefinition>
		</attribute>
		<children/>
	</entity>
</dataModel>
