<?xml version="1.0"?>
<!DOCTYPE dataModel SYSTEM "tableStructure.dtd">

<dataModel>	
<title> Prototype Veg Plots Database Component Description: plotObservation</title>
<author>J. Harris </author>
<institution>NCEAS </institution>
<contributor> </contributor>
<description> </description>
<date>Wed Sep 27 09:06:55 PDT 2000 </date>

<entity>
	<entityName>vegPlot.PLOTOBSERVATION</entityName>
	<entitySummary>This table stores plot information that may vary between sampling events.</entitySummary>
	<entityDescription>Recognizing that a plot may be resampled and that some of the environmental
	conditions may change between resampling events the database design has changed to accomodate this.  
	Now all attributes that are percieved to potentially change on the order of a decade are stored in the 
	plotObservation table whereas those attributes deemed to be regular in time/space are stored in the plot 
	table.
	</entityDescription>
	<attribute> 
		<attName>obs_id </attName>
		<attNulls>No</attNulls>	
		<attType>NUMBER</attType>
		<attKey>P</attKey>
		<attNotes>n/a </attNotes>
		<attDefinition>This is an internal database identifier assigned to each unique observation. </attDefinition>
	</attribute>



	<attribute>
                <attName>parentPlot</attName>
                <attNulls>No</attNulls>
                <attType>NUMBER</attType>
                <attKey>F</attKey>
                <attReferences>PLOT</attReferences>
                <attNotes>Foreign key into the plot table.</attNotes>
                <attDefinition>This represents the link between an observation plot location. </attDefinition>
        </attribute>


	<attribute>
                <attName>previousObs</attName>
                <attNulls>Yes</attNulls>
                <attType>NUMBER</attType>
                <attKey>F</attKey>
                <attReferences>PLOTOBSERVATION</attReferences>
                <attNotes>Recursive foreign key which points to the previous observation in this area</attNotes>
                <attDefinition>This is the plot observtion that was previously made at this plot location.  If observations at a plot are made every year then this key points to the observation number that corresponds to the observation made the year before.</attDefinition>
        </attribute>
<attribute>
                <attName>authorObsCode</attName>
                <attNulls>Yes</attNulls>
                <attType>VARCHAR2</attType>
                <attKey>n/a</attKey>
                <attReferences>n/a</attReferences>
                <attNotes>n/a</attNotes>
                <attDefinition>This is the code that the author uses to identify this observation.</attDefinition>
        </attribute>
<attribute>
                <attName>plotStartDate</attName>
                <attNulls>Yes</attNulls>
                <attType>DATE</attType>
                <attKey>n/a</attKey>
                <attReferences>n/a</attReferences>
                <attNotes>Attribute added at the September meeting at NCEAS.</attNotes>
                <attDefinition>If the observation takes more than a single day then this is the first day in which observations were made.</attDefinition>
        </attribute>
<attribute>
                <attName>plotEndDate</attName>
                <attNulls>Yes</attNulls>
                <attType>DATE</attType>
                <attKey>n/a</attKey>
                <attReferences>n/a</attReferences>
                <attNotes>Attribute added at the September meeting at NCEAS.</attNotes>
                <attDefinition>If the observation takes more than a single day then this is the last day in which observations were made. </attDefinition>
        </attribute>
<attribute>
                <attName>dateAcc</attName>
                <attNulls>Yes</attNulls>
                <attType>NUMBER</attType>
                <attKey>n/a</attKey>
                <attReferences>n/a</attReferences>
                <attNotes>Added at the September meeting at NCEAS. </attNotes>
                <attDefinition>Estimated Accuracy of the observation date.</attDefinition>
        </attribute>
<attribute>
                <attName>effortLevel</attName>
                <attNulls>Yes</attNulls>
                <attType>VARCHAR2</attType>
                <attKey>n/a</attKey>
                <attReferences>n/a</attReferences>
                <attNotes>Use pick list; 
                                 1) Very thorough 
                                 2) Average effort 
                                 3) Hurried description;
                                some less common
                                species may have been
                                missed.</attNotes>
                <attDefinition>This is the effort spent making the observations as estimated by the data collector.</attDefinition>
        </attribute>

	
	<children>taxonObservations, communityType</children>
</entity>
</dataModel>	
