<?xml version="1.0"?>
<!-- edited with XML Spy v4.0 U (http://www.xmlspy.com) by Robert K. Peet (private) -->
<!DOCTYPE dataModel SYSTEM "tableStructure.dtd">
<dataModel>
	<title>Vegetation Plots Database Component Description: classContributor</title>
	<author>John Harris </author>
	<institution>NCEAS </institution>
	<contributor>R.K. Peet</contributor>
	<description/>
	<date>23 Sept 2001</date>
	<entity>
		<entityName>vegPlot.classContributor</entityName>
		<entitySummary>This table stores information about who participated in a classification event</entitySummary>
		<entityDescription>This table serves as an interesection entity used to link a party with
a specific plot classification event.</entityDescription>
		<attribute>
			<attName>CLASSCONTRIBUTOR_ID </attName>
			<attNulls>No </attNulls>
			<attType>NUMBER </attType>
			<attKey>PK </attKey>
			<attReferences>n/a</attReferences>
			<attNotes>Primary key for the classContributor table.</attNotes>
			<attDefinition>Database generated identifier assigned to each unique contribution to the classificaiton of a plot observation. </attDefinition>
		</attribute>
		<attribute>
			<attName>COMMCLASS_ID</attName>
			<attNulls>No </attNulls>
			<attType>NUMBER </attType>
			<attKey>FK </attKey>
			<attReferences>commClass.COMMCLASS_ID</attReferences>
			<attNotes>Foreign key into the commClass table.</attNotes>
			<attDefinition>Observation classification event to which the contributor is associated.   </attDefinition>
		</attribute>
		<attribute>
			<attName>PARTY_ID</attName>
			<attNulls>No </attNulls>
			<attType>NUMBER </attType>
			<attKey>FK </attKey>
			<attReferences>party.PARTY_ID </attReferences>
			<attNotes>Foreign key into the party table.</attNotes>
			<attDefinition>Link to the party that contributed to the classificaiton event.</attDefinition>
		</attribute>
		<attribute>
			<attName>roleCode </attName>
			<attNulls>Yes</attNulls>
			<attType>VARCHAR(30)</attType>
			<attKey>n/a </attKey>
			<attReferences>n/a </attReferences>
			<attNotes>closed list</attNotes>
			<attDefinition>The role that the party had in the classification event (e.g., classifier, consultant, research advisor). </attDefinition>
		</attribute>
		<children/>
	</entity>
</dataModel>
