<?xml version="1.0"?>
<!-- edited with XML Spy v4.0 U (http://www.xmlspy.com) by Robert K. Peet (private) -->
<!DOCTYPE dataModel SYSTEM "tableStructure.dtd">
<dataModel>
	<title>Vegetation Plots Database Component Description: userDefined </title>
	<author>J. Harris </author>
	<institution>NCEAS </institution>
	<contributor>R.K. Peet</contributor>
	<description/>
	<date>31 October 2001</date>
	<entity>
		<entityName>vegPlot.userDefined </entityName>
		<entitySummary/>
		<entityDescription>This table contains the definitions of user-defined variables.  The table structure stems from desire to keep the user-defined variables separate from the main body of the database.  </entityDescription>
		<attribute>
			<attName>USERDEFINED_ID</attName>
			<attNulls>No </attNulls>
			<attType>INT</attType>
			<attKey>PK</attKey>
			<attReferences>n/a</attReferences>
			<attNotes>Primary key for userDefined</attNotes>
			<attDefinition>Database generated identifier assigned to each unique user-defined variable. </attDefinition>
		</attribute>
		<attribute>
			<attName>userDefinedName</attName>
			<attNulls>Yes</attNulls>
			<attType>VARCHAR(30)</attType>
			<attKey>n/a</attKey>
			<attReferences>n/a</attReferences>
			<attNotes>open list</attNotes>
			<attDefinition>Name of the user-defined variable.</attDefinition>
		</attribute>
		<attribute>
			<attName>userDefinedMetadata</attName>
			<attNulls>Yes</attNulls>
			<attType>TEXT</attType>
			<attKey>n/a</attKey>
			<attReferences>n/a</attReferences>
			<attNotes>n/a</attNotes>
			<attDefinition>Metadata about this user-defined variable.</attDefinition>
		</attribute>
		<attribute>
			<attName>userDefinedCategory</attName>
			<attNulls>Yes</attNulls>
			<attType>VARCHAR(30)</attType>
			<attKey>n/a</attKey>
			<attReferences>n/a</attReferences>
			<attNotes>closed list</attNotes>
			<attDefinition>Category of variable; included to facilitate queries for specific types of data.</attDefinition>
		</attribute>
		<attribute>
			<attName>userDefinedType</attName>
			<attNulls>No</attNulls>
			<attType>VARCHAR(20)</attType>
			<attKey>n/a</attKey>
			<attReferences>n/a</attReferences>
			<attNotes>n/a </attNotes>
			<attDefinition>Database data type of the user-defined variable.</attDefinition>
		</attribute>
		<attribute>
			<attName>tableName</attName>
			<attNulls>No</attNulls>
			<attType>VARCHAR(50)</attType>
			<attKey>n/a</attKey>
			<attReferences>n/a</attReferences>
			<attNotes>n/a </attNotes>
			<attDefinition>Name of table with which this user-defined variable is associated.  For example soilBHorizonColor may be defined by the data contributor as associated with the observation table.</attDefinition>
		</attribute>
		<children>definedValue</children>
	</entity>
</dataModel>
