<?xml version="1.0"?>
<!-- edited with XML Spy v4.0 U (http://www.xmlspy.com) by Robert K. Peet (private) -->
<!DOCTYPE dataModel SYSTEM "tableStructure.dtd">
<dataModel>
	<title>Vegetation Plots Database Component Description: plantName</title>
	<author>J. Harris </author>
	<institution>NCEAS </institution>
	<contributor>R.K. Peet</contributor>
	<description/>
	<date>7 February 2002</date>
	<entity>
		<entityName>plantTaxa.plantName</entityName>
		<entitySummary>This table stores plant names</entitySummary>
		<entityDescription/>
		<attribute>
			<attName>PLANTNAME_ID</attName>
			<attNulls>No</attNulls>
			<attType>INT</attType>
			<attKey>PK</attKey>
			<attReferences>n/a</attReferences>
			<attNotes>n/a</attNotes>
			<attDefinition>Database assigned value to each unique record in the plantName table.</attDefinition>
		</attribute>
		<attribute>
			<attName>plantName</attName>
			<attNulls>No</attNulls>
			<attType>VARCHAR(500)</attType>
			<attKey>n/a</attKey>
			<attReferences>n/a</attReferences>
			<attNotes>n/a</attNotes>
			<attDefinition>The plant name.</attDefinition>
		</attribute>
		<attribute>
			<attName>plantNameWithAuthor</attName>
			<attNulls>Yes</attNulls>
			<attType>VARCHAR(100)</attType>
			<attKey>n/a</attKey>
			<attReferences>n/a</attReferences>
			<attNotes>n/a</attNotes>
			<attDefinition>The plant name with any with author notation embedded </attDefinition>
		</attribute>
		<attribute>
			<attName>PLANTREFERENCE_ID</attName>
			<attNulls>No</attNulls>
			<attType>INT</attType>
			<attKey>FK</attKey>
			<attReferences>plantReference.PLANTREFERENCE_ID</attReferences>
			<attNotes>n/a</attNotes>
			<attDefinition>Foreign key into the plantReference table to identify the original source of the name (usually the type description).</attDefinition>
		</attribute>
		<attribute>
			<attName>dateEntered</attName>
			<attNulls>Yes</attNulls>
			<attType>DATE</attType>
			<attKey>n/a</attKey>
			<attReferences>n/a</attReferences>
			<attNotes>n/a</attNotes>
			<attDefinition>Field stores the date that the name was entered into the database.</attDefinition>
		</attribute>
		<children/>
	</entity>
</dataModel>
