<?xml version="1.0"?>
<!-- edited with XML Spy v4.0 U (http://www.xmlspy.com) by Robert K. Peet (private) -->
<!DOCTYPE dataModel SYSTEM "tableStructure.dtd">
<dataModel>
	<title>Vegetation Plots Database Component Description: taxonObservation </title>
	<author>J. Harris </author>
	<institution>NCEAS </institution>
	<contributor>R.K. Peet</contributor>
	<description/>
	<date>23 Sep 2001</date>
	<entity>
		<entityName>taxonObservation</entityName>
		<entitySummary>This table contains the author's determination of a taxon and the overal cover of that taxon.</entitySummary>
		<entityDescription>This table stores information about the original identification of the author of the plot and the taxonomic authority used by that author (i.e. a name - citation pair constituting a taxnomic concept).  The table also contains a record of cumulative cover (cover across all strata) of the taxon when not divided into strata.</entityDescription>
		<attribute>
			<attName>TAXONOBSERVATION_ID</attName>
			<attNulls>No</attNulls>
			<attType>INT</attType>
			<attKey>PK</attKey>
			<attReferences>n/a</attReferences>
			<attNotes>Primary key of the table.</attNotes>
			<attDefinition>Database generated identifier assigned to each unique observation of a taxon in a plot. </attDefinition>
		</attribute>
		<attribute>
			<attName>OBSERVATION_ID</attName>
			<attNulls>No</attNulls>
			<attType>INT</attType>
			<attKey>FK</attKey>
			<attReferences>observation.OBSERVATION_ID</attReferences>
			<attNotes>Foreign key into the plotObservation table.</attNotes>
			<attDefinition>Link to the parent observation event of this taxonl observation.</attDefinition>
		</attribute>
		<attribute>
			<attName>TAXONNAME_ID</attName>
			<attNulls>No</attNulls>
			<attType>INT</attType>
			<attKey>FK</attKey>
			<attReferences>taxonName.TAXONNAME_ID</attReferences>
			<attNotes>Foreign key into taxonName table. </attNotes>
			<attDefinition>The taxon name that the author of the plot used to refer to a taxon observed within the plot. </attDefinition>
		</attribute>
		<attribute>
			<attName>TAXONREFERENCE_ID</attName>
			<attNulls>No</attNulls>
			<attType>INT</attType>
			<attKey>FK</attKey>
			<attReferences>taxonReference.TAXONREFERENCE_ID</attReferences>
			<attNotes>Foreign key into the taxonReference table.</attNotes>
			<attDefinition>The authority for the taxon that was used by the plot author.  If the authority is unknown  the author of the plot is the authority. For other than legacy data, this field plus taxonName_ID will be sufficient to determine taxonInterpretation.taxonConcept_ID.</attDefinition>
		</attribute>
		<attribute>
			<attName>taxonCollection</attName>
			<attNulls>Yes</attNulls>
			<attType>VARCHAR(100)</attType>
			<attKey>n/a</attKey>
			<attReferences>n/a</attReferences>
			<attNotes>n/a</attNotes>
			<attDefinition>Specifics about the location of a collection made of the taxon</attDefinition>
		</attribute>
		<attribute>
			<attName>taxonCover</attName>
			<attNulls>Yes</attNulls>
			<attType>NUMERIC(3,2)</attType>
			<attKey>n/a</attKey>
			<attReferences>n/a</attReferences>
			<attNotes>(could be calculated)</attNotes>
			<attDefinition>Overall cover of the taxon across all strata</attDefinition>
		</attribute>
		<attribute>
			<attName>taxonBasalArea</attName>
			<attNulls>Yes</attNulls>
			<attType>NUMERIC(3,5)</attType>
			<attKey>n/a</attKey>
			<attReferences>n/a</attReferences>
			<attNotes>n/a</attNotes>
			<attDefinition>Total basal area of the species in the stemInferenceArea in m2/ha</attDefinition>
		</attribute>
		<attribute>
			<attName>taxonInferenceArea</attName>
			<attNulls>Yes</attNulls>
			<attType>NUMERIC(5,3)</attType>
			<attKey>n/a</attKey>
			<attReferences>n/a</attReferences>
			<attNotes>The area used to infer the coverage of the taxon, if not the same as observation.taxonInferenceArea.</attNotes>
			<attDefinition>This is the area in m2 used to infer the cover of a given taxon.  Generally this should be equal to observation.taxonInferenceArea, but at times this area may be larger or smaller.</attDefinition>
		</attribute>
		<children/>
	</entity>
</dataModel>
