<?xml version="1.0"?>
<!-- edited with XML Spy v4.3 U (http://www.xmlspy.com) by Robert K. Peet (private) -->
<!DOCTYPE dataModel SYSTEM "tableStructure.dtd">
<dataModel>
	<title>Vegetation Plots Database Component Description: commName</title>
	<author>J. Harris </author>
	<institution>NCEAS </institution>
	<contributor>R.K. Peet</contributor>
	<description/>
	<date>7 February 2002</date>
	<entity>
		<entityName>commTaxa.commName</entityName>
		<entitySummary>This table stores vegetation community names</entitySummary>
		<entityDescription/>
		<attribute>
			<attName>COMMNAME_ID</attName>
			<attNulls>No</attNulls>
			<attType>INT</attType>
			<attKey>PK</attKey>
			<attReferences>n/a</attReferences>
			<attNotes>n/a</attNotes>
			<attDefinition>Database assigned value to each unique record in the commName table.</attDefinition>
		</attribute>
		<attribute>
			<attName>commName</attName>
			<attNulls>No</attNulls>
			<attType>VARCHAR(500)</attType>
			<attKey>n/a</attKey>
			<attReferences>n/a</attReferences>
			<attNotes>n/a</attNotes>
			<attDefinition>The community name.</attDefinition>
		</attribute>
		<attribute>
			<attName>COMMREFERENCE_ID</attName>
			<attNulls>Yes</attNulls>
			<attType>INT</attType>
			<attKey>FK</attKey>
			<attReferences>commReference.COMMREFERENCE_ID</attReferences>
			<attNotes>n/a</attNotes>
			<attDefinition>Foreign key into commReference to identify the source of the name.</attDefinition>
		</attribute>
		<attribute>
			<attName>dateEntered</attName>
			<attNulls>Yes</attNulls>
			<attType>DATE</attType>
			<attKey>n/a</attKey>
			<attReferences>n/a</attReferences>
			<attNotes>n/a</attNotes>
			<attDefinition>Field stores the date that the name was entered into the database.</attDefinition>
		</attribute>
		<children/>
	</entity>
</dataModel>
