<?xml version="1.0"?>
<!-- edited with XML Spy v4.0 U (http://www.xmlspy.com) by Robert K. Peet (private) -->
<!DOCTYPE dataModel SYSTEM "tableStructure.dtd">
<dataModel>
	<title>Prototype Veg Plots Database Component Description: commLineage</title>
	<author>J. Harris </author>
	<institution>NCEAS </institution>
	<contributor/>
	<description/>
	<date/>
	<entity>
		<entityName>comm.commLineation</entityName>
		<entitySummary>This table stores tracks the lineage of vegetation community 
concepts.</entitySummary>
		<entityDescription/>
		<attribute>
			<attName>LINEAGE_ID</attName>
			<attNulls>No</attNulls>
			<attType>INT</attType>
			<attKey>PK</attKey>
			<attReferences>n/a</attReferences>
			<attNotes>n/a</attNotes>
			<attDefinition>Database assigned value to each unique record in the commLineage table.</attDefinition>
		</attribute>
		<attribute>
			<attName>CONCEPT1_ID</attName>
			<attNulls>NO</attNulls>
			<attType>INT</attType>
			<attKey>n/a</attKey>
			<attReferences>commConcept</attReferences>
			<attNotes>n/a</attNotes>
			<attDefinition>This is the foreign key into the commConcept table 
"pointing" to the child concept.</attDefinition>
		</attribute>
		<attribute>
			<attName>CONCEPT2_ID</attName>
			<attNulls>NO</attNulls>
			<attType>INT</attType>
			<attKey>n/a</attKey>
			<attReferences>commConcept</attReferences>
			<attNotes>n/a</attNotes>
			<attDefinition>This is the foreign key into the commConcept table 
"pointing" to the parent concept.</attDefinition>
		</attribute>
		<children/>
	</entity>
</dataModel>
